{
  "$schema": "../schema/project.schema.json",
  "id": "ergo-protocol",
  "name": "Ergo protocol",
  "url": "https://ergoplatform.org",
  "repo": "https://github.com/ergoplatform/ergo",
  "category": "protocol",
  "by": "ergoscan",
  "contracts": [
    {
      "name": "Emission",
      "kind": "contract",
      "match": {
        "address": "2Z4YBkDsDvQj8BX7xiySFewjitqp2ge9c99jfes2whbtKitZTxdBYqbrVZUvZvKv6aqn9by4kp3LE1c26LCyosFnVnm6b6U1JYvWpYmL2ZnixJbXLjWAWuBThV1D6dLpqZJYQHYDznJCk49g5TUiS4q8khpag2aNmHwREV7JSsypHdHLgJT7MGaw51aJfNubyzSKxZ4AJXFS27EfXwyCLzW1K6GVqwkJtCoPvrcLqmqwacAWJPkmh78nke9H4oT88XmSbRt2n9aWZjosiZCafZ4osUDxmZcc5QVEeTWn8drSraY3eFKe8Mu9MSCcVU"
      },
      "source": "protocol",
      "note": "Emission contract"
    },
    {
      "name": "Emission proxy",
      "kind": "contract",
      "match": {
        "address": "6KxusedL87PBibr1t1f4ggzAyTAmWEPqSpqXbkdoybNwHVw5Nb7cUESBmQw5XK8TyvbQiueyqkR9XMNaUgpWx3jT54p"
      },
      "source": "protocol",
      "note": "EIP-27 pay-to-reemission"
    },
    {
      "name": "Miner fee",
      "kind": "contract",
      "match": {
        "address": "2iHkR7CWvD1R4j1yZg5bkeDRQavjAaVPeTDFGGLZduHyfWMuYpmhHocX8GJoaieTx78FntzJbCBVL6rf96ocJoZdmWBL2fci7NqWgAirppPQmZ7fN9V6z13Ay6brPriBKYqLp1bT2Fk4FkFLCfdPpe"
      },
      "source": "protocol",
      "note": "Miners fee contract"
    },
    {
      "name": "Reemission",
      "kind": "contract",
      "match": {
        "address": "22WkKcVUvboYCZJe1urbmvBL3j67LKb5KEAvFhJXqA6ubYvHpSCvbvwvEY3xzUr7QvxpEtqjzMAPMsVdZh1VGWmZphvKoJdVzL1ayhsMftTtEFoA3YYdq3zKeeYXavVrrPUmK3fRXJ2HWEbZexewtBWcgAnHBw5tKvYFy9dEUi645gE2fYMUvVBtbvMExE9mjZ2W9goWkqu1VtThAsMZWZWjHxDjX116HpeQKu9b9neEUBj4kE5sX8QXaV6ZeReXxYHFJFg2rmaTknSPMxHXA8NpQKgzryBwLssp5EJ1QTqn5R6xuvGgFCEUZicCEo8qk8UNbE7e2d4WqW5qzpQPzJkKoPa5UtJEPYDWNhaCKmCpzdSc77"
      },
      "source": "protocol",
      "note": "EIP-27 reemission contract"
    }
  ]
}
