{
  "$schema": "../schema/project.schema.json",
  "id": "kucoin",
  "name": "KuCoin",
  "url": "https://www.kucoin.com",
  "category": "exchange",
  "by": "ergoscan",
  "contracts": [
    {
      "name": "KuCoin main 1eHxWs",
      "kind": "wallet",
      "match": {
        "address": "9how9k2dp67jXDnCM6TeRPKtQrToCs5MYL2JoSgyGHLXm1eHxWs"
      },
      "source": "https://ergo.watch"
    },
    {
      "name": "KuCoin main 35oXvT",
      "kind": "wallet",
      "match": {
        "address": "9iNt6wfxSc3DSaBVp22E7g993dwKUCvbGdHoEjxF8SRqj35oXvT"
      },
      "source": "https://ergo.watch"
    },
    {
      "name": "KuCoin main 5XYgAu",
      "kind": "wallet",
      "match": {
        "address": "9hU5VUSUAmhEsTehBKDGFaFQSJx574UPoCquKBq59Ushv5XYgAu"
      },
      "source": "https://ergo.watch"
    },
    {
      "name": "KuCoin main LbmUBr",
      "kind": "wallet",
      "match": {
        "address": "9guZaxPoe4jecHi6ZxtMotKUL4AzpomFf3xqXsFSuTyZoLbmUBr"
      },
      "source": "https://ergo.watch"
    },
    {
      "name": "KuCoin main W5vBi3",
      "kind": "wallet",
      "match": {
        "address": "9i8Mci4ufn8iBQhzohh4V3XM3PjiJbxuDG1hctouwV4fjW5vBi3"
      },
      "source": "https://ergo.watch"
    },
    {
      "name": "KuCoin main aBar1Z",
      "kind": "wallet",
      "match": {
        "address": "9fpUtN7d22jS3cMWeZxBbzkdnHCB46YRJ8qiiaVo2wRCkaBar1Z"
      },
      "source": "https://ergo.watch"
    },
    {
      "name": "KuCoin main c1zc1c",
      "kind": "wallet",
      "match": {
        "address": "9fs7HkPGY9fhN6WsHd7V7LMcuMqsgseXzNahyToxJKwHCc1zc1c"
      },
      "source": "https://ergo.watch"
    }
  ]
}
