{
  "$schema": "../schema/project.schema.json",
  "id": "basis",
  "name": "Basis",
  "url": "https://github.com/BetterMoneyLabs/basis-tracker",
  "repo": "https://github.com/BetterMoneyLabs/basis-tracker",
  "category": "protocol",
  "by": "ergoscan",
  "note": "Offchain IOU notes with an on-chain reserve. The two reserve scripts are published in basis-tracker. A tracker box is the operator's own box, not a third contract.",
  "contracts": [
    {
      "name": "Basis ERG reserve",
      "kind": "contract",
      "match": {
        "address": "3PQnJ92Krn6NeM1GdMSmNayw34Nuud7UKMoKSTRUTucsNybh99K1HEfjZqyvP7cPag1yBkDv3ruMAgb2NsVKq3tAygjHz7mKDzHK6CJGhD3WfNViD7DoViqbgsXrzvs6Kt8Wyzb48uGqJAFQFWes6ZPKELqUZowy8xtVCS5w1VwnyaeRiWpEyUVGaEHw3qWo5DcVxzmMAP8XXhVTw1rYYrUxsyGPNaBxQkkkTVD9L3bmw77EfeAJgJ1hLxghykNofHscHtMtES4v5FSfqke3Huun81S7gNoraEnsR6Dy6YnQgrBswwCZhyGc89YeNFQn1TCFh5Hct3nKGrd1bV5zoCw67Q9fKtoaCtvcPQ2GDWycGKNRNgyAnPEa8WbHbTEVcjAN25aBwhnY5LFGqYxnUAjhpfkTPJ4FJWRijSqMESzpyrmhTLZdivmn4YSwcchVZr7bHGbfncEDwqPKefdoxNnVPxuVdmeqQXL3aDL7TaqWgExzz1UPXHw3UiKYTUkNgQKCN4WV3LHqc9PecoisL77ydVbSCxPapaX2zTf26F8bGK3hsTVBZnMkt93SJP5GmPgZU5FT9NkFh4okjXK9ce2wmA4MV93ySyYnUKGwTRFJWwE7G1MYqBqTY3ESkn8PJHqVuL4cgtuV2GEPagKt19befRAuUV3FaLGVPJMzpKdANd7hKGZRcy3DnPfT1Q9dyFD4VpdBgFRXJWaaDqYjL7ni4nJcKKam9P395wRRnjGWhTV4hv3KoxC8Xk2CZAUjhkTzvuNHxQrLsWjyrKWJqZgs2uZxoAEHEobDegYWiTcnFCPU9EeJxZLSjysDFninqpQvA66Yt1SvJnSZm49RKsaoR98UJVScdiQfNZE76zTYBioXGatdRz7QVkXDzDPjPMu9Hhepc2XbHqo3ia8tszHptbnSzm2R3PC7iu2Tnhu3QT"
      },
      "source": "https://github.com/BetterMoneyLabs/basis-tracker/blob/25a01a39dd967cb74d9e88b3771986790cc06676/crates/basis_store/src/contract_compiler.rs#L18",
      "note": "ERG lockbox. Compiled address of contract/basis.es. Every ERG safe uses this script. The owner can start a refund; creditors have 43200 blocks to redeem."
    },
    {
      "name": "Basis token reserve",
      "kind": "contract",
      "match": {
        "address": "96HrjMftJd4NbjzufhMHXyZqzaUbdc5zUqtSySUnyEZoHogM9TD9RsRNkhq83tGaWTH4ZiFeDKzAdHkQyi1SWwMdkKtDaDhobhsrb5tjEDZkYhhF5aPGf3b4fUo3W23tec9N7GyzA6buyhRYzf3DqVWRsJGzCEdYeDfcMYKXon3wMxMFgQPX4FUbCAGe32dCd1aiFwQwx4Rnjy19G6qPaACdZvfSNFLgM1ur3U6HSSMX22g5o8MbbxzNeKScWFedW76z1zCmC38BrgiSv1qC7395yi9y4dDy2y26Tgrc2MPxvned5j1F3cTTTY9HVPYcS9U4vQocDRHufEkMG4dyu7eQqiHbqa6962B1jKQUMofyNV2mehQDrTzfzT5yHPsTeAGMTbDHeDECsmmJ2ideonha9VBuEP6fivixWjej43spbMZDcy3SCNa5gTrLuhh8gN4j8CbMncTXYghrxNdRqPbiUfJy8rMpcdeRaDnbodibGAyJqzzh95ZC6FHPwL7UQZbFbc472WSPtPRXU9g7QpZasdYtZb4GrHqvUJASsLwgYsRevJ4QZ24nrcUXv5ttziaVsGfeCW35viGB5zc3Sxk8e37smwQzWPfAGvsLfgy98dJfmNFyQUCNUyGX5qq4uJrKNaRamouL4S1VNFcgVaJTdGDTT7ykcy6qLmaFg6tUiAsLLC2p4GGB83fqsw13hfmxCxMGuFQUFu6aNc9W31wMMJ2beCN7Xb7cUkffzEXZnjiqFKMicTHsmvLz2mZuAgiKykrxqNTMqmTd2DjGsuYmQNtLXqS4j5d9qXnSVxmeVGp3cqcC7NYF9ujvLT38yqfnk5tZ5X9gnMXgkkKk8MfuUgY5a2ccSgbetkj7yNk1ciHK1QYGrvydDPWB2kJEQb9yAb72Uf1jZXVH1kSAr7vv1BBRQWveJcsjD6GQVKXJrLTGLrR5XV1uYK7uQSR4XYEi5yJsjk4rPMCDtt2FDsrUk7bo9suFWq2sqZxQZZWEgoKkwog6DtvyX4cyMpT45eeqjctBTjnAnJRf8CgBuyEhfU8RMfG7dPNVk9EWS3JbGmwow4R95Ae5P"
      },
      "source": "https://github.com/BetterMoneyLabs/basis-tracker/blob/25a01a39dd967cb74d9e88b3771986790cc06676/crates/basis_store/src/contract_compiler.rs#L30",
      "note": "Token lockbox. Compiled address of contract/basis-token.es. The note and the collateral are the same token."
    }
  ]
}
