{
  "$schema": "../schema/project.schema.json",
  "id": "spectrum",
  "name": "Spectrum Finance",
  "url": "https://spectrum.fi",
  "repo": "https://github.com/spectrum-finance/ergo-dex",
  "category": "dex",
  "by": "ergoscan",
  "contracts": [
    {
      "name": "Spectrum AMM Pool (ERG/token)",
      "kind": "contract",
      "match": {
        "address": "5vSUZRZbdVbnk4sJWjg2uhL94VZWRg4iatK9VgMChufzUgdihgvhR8yWSUEJKszzV7Vmi6K8hCyKTNhUaiP8p5ko6YEU9yfHpjVuXdQ4i5p4cRCzch6ZiqWrNukYjv7Vs5jvBwqg5hcEJ8u1eerr537YLWUoxxi1M4vQxuaCihzPKMt8NDXP4WcbN6mfNxxLZeGBvsHVvVmina5THaECosCWozKJFBnscjhpr3AJsdaL8evXAvPfEjGhVMoTKXAb2ZGGRmR8g1eZshaHmgTg2imSiaoXU5eiF3HvBnDuawaCtt674ikZ3oZdekqswcVPGMwqqUKVsGY4QuFeQoGwRkMqEYTdV2UDMMsfrjrBYQYKUBFMwsQGMNBL1VoY78aotXzdeqJCBVKbQdD3ZZWvukhSe4xrz8tcF3PoxpysDLt89boMqZJtGEHTV9UBTBEac6sDyQP693qT3nKaErN8TCXrJBUmHPqKozAg9bwxTqMYkpmb9iVKLSoJxG7MjAj72SRbcqQfNCVTztSwN3cRxSrVtz4p87jNFbVtFzhPg7UqDwNFTaasySCqM"
      },
      "source": "https://github.com/spectrum-finance/ergo-dex-sdk-js/blob/62e1c4ada2b776ad0a90b4cfcd6d075ec5083e21/src/amm/common/contracts/n2tTemplates.ts#L2",
      "note": "One contract for every ERG/token pool; each pool box carries its own pool NFT"
    },
    {
      "name": "Spectrum AMM Pool (token/token)",
      "kind": "contract",
      "match": {
        "address": "3gb1RZucekcRdda82TSNS4FZSREhGLoi1FxGDmMZdVeLtYYixPRviEdYireoM9RqC6Jf4kx85Y1jmUg5XzGgqdjpkhHm7kJZdgUR3VBwuLZuyHVqdSNv3eanqpknYsXtUwvUA16HFwNa3HgVRAnGC8zj8U7kksrfjycAM1yb19BB4TYR2BKWN7mpvoeoTuAKcAFH26cM46CEYsDRDn832wVNTLAmzz4Q6FqE29H9euwYzKiebgxQbWUxtupvfSbKaHpQcZAo5Dhyc6PFPyGVFZVRGZZ4Kftgi1NMRnGwKG7NTtXsFMsJP6A7yvLy8UZaMPe69BUAkpbSJdcWem3WpPUE7UpXv4itDkS5KVVaFtVyfx8PQxzi2eotP2uXtfairHuKinbpSFTSFKW3GxmXaw7vQs1JuVd8NhNShX6hxSqCP6sxojrqBxA48T2KcxNrmE3uFk7Pt4vPPdMAS4PW6UU82UD9rfhe3SMytK6DkjCocuRwuNqFoy4k25TXbGauTNgKuPKY3CxgkTpw9WfWsmtei178tLefhUEGJueueXSZo7negPYtmcYpoMhCuv4G1JZc283Q7f3mNXS"
      },
      "source": "https://github.com/spectrum-finance/ergo-dex-sdk-js/blob/62e1c4ada2b776ad0a90b4cfcd6d075ec5083e21/src/amm/common/contracts/t2tTemplates.ts#L2",
      "note": "One contract for every token/token pool; each pool box carries its own pool NFT"
    }
  ]
}
