{
  "$schema": "../schema/project.schema.json",
  "id": "fenixpool",
  "name": "FenixPool",
  "category": "mining-pool",
  "by": "ergoscan",
  "contracts": [
    {
      "name": "FenixPool miner reward",
      "kind": "contract",
      "match": {
        "address": "88dhgzEuTXaTbDYDwHicJ7F8ZhWdh5NGXBmCYhtx69AZBhnDHijLX4e3fBnJW1zR5ky9vrb5PaaopxtU"
      },
      "source": "chain"
    }
  ],
  "url": "https://fenixpool.com"
}
